{
  "meta": {
    "dataVersion": "competition-demo-v3",
    "schema": "campus-demo/v3",
    "timezone": "Asia/Shanghai",
    "demoReferenceDate": "2026-08-31",
    "generatedBy": "competition/adp-kit/mock-data/generate-competition-demo-v3.js",
    "anonymization": "本数据集全部为虚构匿名演示数据，不对应任何真实学校、学院、教师、学生、用户与团队身份。",
    "semester": {
      "id": "2026-2027-1",
      "name": "2026-2027学年第一学期",
      "startDate": "2026-08-31",
      "endDate": "2027-01-17",
      "totalWeeks": 20
    },
    "periods": [
      {
        "period": 1,
        "start": "08:00",
        "end": "08:45"
      },
      {
        "period": 2,
        "start": "08:55",
        "end": "09:40"
      },
      {
        "period": 3,
        "start": "10:00",
        "end": "10:45"
      },
      {
        "period": 4,
        "start": "10:55",
        "end": "11:40"
      },
      {
        "period": 5,
        "start": "14:00",
        "end": "14:45"
      },
      {
        "period": 6,
        "start": "14:55",
        "end": "15:40"
      },
      {
        "period": 7,
        "start": "16:00",
        "end": "16:45"
      },
      {
        "period": 8,
        "start": "16:55",
        "end": "17:40"
      },
      {
        "period": 9,
        "start": "19:00",
        "end": "19:45"
      },
      {
        "period": 10,
        "start": "19:55",
        "end": "20:40"
      }
    ],
    "weekdayNames": [
      "周一",
      "周二",
      "周三",
      "周四",
      "周五",
      "周六",
      "周日"
    ],
    "designedScenarios": [
      {
        "id": "g01",
        "name": "single-teacher-conflict",
        "description": "teacher-012 周二5-6 同时上计算思维与信息素养（单教师硬冲突）"
      },
      {
        "id": "g02",
        "name": "class-conflict",
        "description": "class-life-01 周五5-6 同时上普通生物学与生物实验（班级硬冲突）"
      },
      {
        "id": "g03",
        "name": "room-conflict",
        "description": "room-a-101 周四5-6 同时容纳统计学与电路基础（教室硬冲突）"
      },
      {
        "id": "g04",
        "name": "cross-campus-rush-20min",
        "description": "teacher-003 周一 5-6@校区A 数据结构 → 7-8@校区B 程序设计（A→B=20分钟赶场）"
      },
      {
        "id": "g05",
        "name": "cross-campus-enough-gap",
        "description": "teacher-030 周三 5-6@校区C 市场分析 → 7-8@校区D 电子商务（C→D=10分钟，间隔20分钟非风险）"
      },
      {
        "id": "g06",
        "name": "consecutive-4-periods-lab",
        "description": "chem-01 无机化学实验 周三3-6 连续4节实验"
      },
      {
        "id": "g07",
        "name": "high-load-teacher",
        "description": "teacher-039 承担 8 条体育课（高负载教师）"
      },
      {
        "id": "g08",
        "name": "low-load-teacher",
        "description": "teacher-038 仅承担 1 条教学实习（低负载教师）"
      },
      {
        "id": "g09",
        "name": "high-utilization-room",
        "description": "room-a-101 同一 slot 两条且多 slot 复用（高利用率教室）"
      },
      {
        "id": "g10",
        "name": "low-utilization-room",
        "description": "存在课时数<=2 的教室（低利用率教室样例）"
      },
      {
        "id": "g11",
        "name": "multi-teacher-common-free",
        "description": "teacher-005/teacher-006/teacher-014 周四上午均空闲（共同空闲阳性）"
      },
      {
        "id": "g12",
        "name": "no-common-free",
        "description": "teacher-012/teacher-013 周四下午 5-6 与 7-8 互相占满（无共同空闲）"
      },
      {
        "id": "g13",
        "name": "capacity-tiered",
        "description": "60/100/120 容量教室 + 38~120 班级规模分级筛选"
      },
      {
        "id": "g14",
        "name": "feature-match",
        "description": "课程 requiredFeatures 与教室 features 一致；reschedule_feasibility 可构造不匹配样例"
      },
      {
        "id": "g15",
        "name": "evening-course",
        "description": "biz-01 电子商务 周五9-10 晚间课"
      },
      {
        "id": "g16",
        "name": "weekend-course",
        "description": "bio-01 生物信息学 周六1-2 周末课"
      },
      {
        "id": "g17",
        "name": "odd-even-weeks",
        "description": "单/双周交替课程（如 1-16(单)、1-8(双)）"
      },
      {
        "id": "g18",
        "name": "irregular-cross-week",
        "description": "psych-01 研讨课 1-4,7-10 周跨周不规则"
      },
      {
        "id": "g19",
        "name": "group-plan-candidates",
        "description": "共同空闲+空教室+容量+设备需求 的 group_plan 多候选/无候选资源"
      },
      {
        "id": "g20",
        "name": "reschedule-feasibility",
        "description": "调课可行 / 调课教师冲突 / 调课教室冲突 / 调课容量不足 的正负样例数据基础"
      }
    ],
    "dataHash": "sha1:903cd3edc1af"
  },
  "campuses": [
    {
      "id": "campus-a",
      "name": "校区A",
      "buildings": [
        "A综合教学楼",
        "A公共教学楼",
        "A基础实验楼",
        "A工程实践楼",
        "A创新中心",
        "A体育场馆"
      ]
    },
    {
      "id": "campus-b",
      "name": "校区B",
      "buildings": [
        "B综合教学楼",
        "B公共教学楼",
        "B基础实验楼",
        "B工程实践楼",
        "B创新中心",
        "B体育场馆"
      ]
    },
    {
      "id": "campus-c",
      "name": "校区C",
      "buildings": [
        "C综合教学楼",
        "C公共教学楼",
        "C基础实验楼",
        "C工程实践楼",
        "C创新中心",
        "C体育场馆"
      ]
    },
    {
      "id": "campus-d",
      "name": "校区D",
      "buildings": [
        "D综合教学楼",
        "D公共教学楼",
        "D基础实验楼",
        "D工程实践楼",
        "D创新中心",
        "D体育场馆"
      ]
    }
  ],
  "campusTravelMatrix": {
    "unit": "minutes",
    "matrix": {
      "campus-a": {
        "campus-b": 20,
        "campus-c": 30,
        "campus-d": 45
      },
      "campus-b": {
        "campus-a": 20,
        "campus-c": 12,
        "campus-d": 28
      },
      "campus-c": {
        "campus-a": 30,
        "campus-b": 12,
        "campus-d": 10
      },
      "campus-d": {
        "campus-a": 45,
        "campus-b": 28,
        "campus-c": 10
      }
    }
  },
  "colleges": [
    {
      "id": "college-cs",
      "name": "工程与计算类"
    },
    {
      "id": "college-sci",
      "name": "基础科学类"
    },
    {
      "id": "college-life",
      "name": "生命与环境类"
    },
    {
      "id": "college-hum",
      "name": "人文与设计类"
    },
    {
      "id": "college-bus",
      "name": "经管与公共类"
    },
    {
      "id": "college-edu",
      "name": "教育与体育类"
    }
  ],
  "classes": [
    {
      "id": "class-cs-01",
      "name": "2025级计算机类01班",
      "collegeId": "college-cs",
      "campusId": "campus-a",
      "size": 120
    },
    {
      "id": "class-cs-02",
      "name": "2025级计算机类02班",
      "collegeId": "college-cs",
      "campusId": "campus-a",
      "size": 56
    },
    {
      "id": "class-sw-01",
      "name": "2025级软件类01班",
      "collegeId": "college-cs",
      "campusId": "campus-a",
      "size": 48
    },
    {
      "id": "class-me-01",
      "name": "2024级机械类01班",
      "collegeId": "college-cs",
      "campusId": "campus-a",
      "size": 48
    },
    {
      "id": "class-math-01",
      "name": "2025级数学类01班",
      "collegeId": "college-sci",
      "campusId": "campus-a",
      "size": 52
    },
    {
      "id": "class-phy-01",
      "name": "2025级物理类01班",
      "collegeId": "college-sci",
      "campusId": "campus-a",
      "size": 46
    },
    {
      "id": "class-chem-01",
      "name": "2025级化学类01班",
      "collegeId": "college-sci",
      "campusId": "campus-a",
      "size": 48
    },
    {
      "id": "class-stat-01",
      "name": "2024级统计类01班",
      "collegeId": "college-sci",
      "campusId": "campus-a",
      "size": 46
    },
    {
      "id": "class-chi-01",
      "name": "2025级中文类01班",
      "collegeId": "college-hum",
      "campusId": "campus-b",
      "size": 55
    },
    {
      "id": "class-jour-01",
      "name": "2025级传播类01班",
      "collegeId": "college-hum",
      "campusId": "campus-b",
      "size": 44
    },
    {
      "id": "class-design-01",
      "name": "2025级设计类01班",
      "collegeId": "college-hum",
      "campusId": "campus-b",
      "size": 44
    },
    {
      "id": "class-hist-01",
      "name": "2024级历史类01班",
      "collegeId": "college-hum",
      "campusId": "campus-b",
      "size": 44
    },
    {
      "id": "class-biz-01",
      "name": "2025级经管类01班",
      "collegeId": "college-bus",
      "campusId": "campus-b",
      "size": 90
    },
    {
      "id": "class-econ-01",
      "name": "2025级经济类01班",
      "collegeId": "college-bus",
      "campusId": "campus-b",
      "size": 48
    },
    {
      "id": "class-acct-01",
      "name": "2025级会计类01班",
      "collegeId": "college-bus",
      "campusId": "campus-b",
      "size": 45
    },
    {
      "id": "class-pub-01",
      "name": "2024级公共类01班",
      "collegeId": "college-bus",
      "campusId": "campus-b",
      "size": 44
    },
    {
      "id": "class-life-01",
      "name": "2025级生命科学类01班",
      "collegeId": "college-life",
      "campusId": "campus-c",
      "size": 100
    },
    {
      "id": "class-life-02",
      "name": "2025级生命科学类02班",
      "collegeId": "college-life",
      "campusId": "campus-c",
      "size": 48
    },
    {
      "id": "class-bio-01",
      "name": "2025级生物类01班",
      "collegeId": "college-life",
      "campusId": "campus-c",
      "size": 46
    },
    {
      "id": "class-env-01",
      "name": "2024级环境类01班",
      "collegeId": "college-life",
      "campusId": "campus-c",
      "size": 45
    },
    {
      "id": "class-edu-01",
      "name": "2025级教育类01班",
      "collegeId": "college-edu",
      "campusId": "campus-d",
      "size": 72
    },
    {
      "id": "class-pe-01",
      "name": "2025级体育类01班",
      "collegeId": "college-edu",
      "campusId": "campus-d",
      "size": 40
    },
    {
      "id": "class-psych-01",
      "name": "2025级心理类01班",
      "collegeId": "college-edu",
      "campusId": "campus-d",
      "size": 42
    },
    {
      "id": "class-prim-01",
      "name": "2024级小学教育类01班",
      "collegeId": "college-edu",
      "campusId": "campus-d",
      "size": 38
    }
  ],
  "teachers": [
    {
      "id": "teacher-001",
      "name": "教师001",
      "collegeId": "college-sci",
      "title": "教授"
    },
    {
      "id": "teacher-002",
      "name": "教师002",
      "collegeId": "college-sci",
      "title": "副教授"
    },
    {
      "id": "teacher-003",
      "name": "教师003",